2104,Requiem,https://image.tmdb.org/t/p/w500//hf1gIOsdIZn5AqmozMFqtAjXMQB.jpg,https://image.tmdb.org/t/p/original/,"Four hardened crooks break out of prison. Hunted down, with nowhere to run, they seek refuge in the only place the police cannot follow, a Cistercian monastery. Cut off from the outside world, a nightmare stand off develops between the fugitives, ready to kill in defence of their dearly purchased freedom, and the monks they' re holding hostage. But in this potentially lethal confrontation, nothing is quite as it seems. The game' s been rigged from the start. Requiem' s a violent and fast paced French film that really delivers.",2001-12-28,98,tagline,4
2138,Berlin Snuff,https://image.tmdb.org/t/p/w500//uq1Fo6HvGiHOL8C3ZjOzKljSZxO.jpg,https://image.tmdb.org/t/p/original/,No overview found.,1995-01-01,33,tagline,5
2151,Man with the Screaming Brain,https://image.tmdb.org/t/p/w500//nIwNki3UiRKGUzk7BrEFfNJ4as9.jpg,https://image.tmdb.org/t/p/original/,The brains of a Russian taxi driver and a wealthy businessman are brought together in one body by a mad scientist.,2005-04-03,90,He's losing their minds,5
2154,The Dark Side of The Moon,https://image.tmdb.org/t/p/w500//1QacnwQQHEERUjRuoKE2VTlxK3v.jpg,https://image.tmdb.org/t/p/original//7unts3WuAyJCJpbdZFe6PQXiO7n.jpg,"It is the year 2022. A mysterious systems failure causes the crew of a spaceship to be stranded on the dark side of the moon, while rapidly running out of fuel and oxygen. They are surprised to discover a NASA space shuttle floating in space, and board it in the hope of salvaging some supplies. One by one, the crew is possessed and killed, and it is up to Paxton Warner to find the links between the dark side of the moon, the Bermuda Triangle, and the Devil himself.",1990-05-30,96,Beyond Rescue ... Beyond Reason ... Beyond Salvation,4
2182,Attack of the Killer Tomatoes!,https://image.tmdb.org/t/p/w500//cpQFOXpi5OlUnX6g3hLIoe6L7MC.jpg,https://image.tmdb.org/t/p/original//n8jSLMc8zT2p1rELAUyRCc3VN7B.jpg,"Attack of the Killer Tomatoes is a 1978 comedy film directed by John De Bello and starring David Miller. The film is a spoof of B-movies. Made on a budget of less than USD $100,000, the story involves tomatoes becoming sentient by unknown means and revolting against humanity.",1978-10-01,87,Aaargh!...,4
2186,Within the Woods,https://image.tmdb.org/t/p/w500//7GbiPMIn0VT00n8MpF9ZpBBVBDs.jpg,https://image.tmdb.org/t/p/original/,The low budget film starring the young Bruce Campbell that influenced the Evil Dead films.,1978-11-23,32,tagline,6
2199,My Mom's a Werewolf,https://image.tmdb.org/t/p/w500//7Wu3uPNbmmaAsZI1CFK6PY87XGN.jpg,https://image.tmdb.org/t/p/original/,"The frustrated housewife Leslie visits an animal shop to purchase a flea-collar. Unknowing that the owner is a werewolf, she accepts his invitation to lunch and later in his apartment. Through a bite in her toe he starts her slow transformation in a werewolf. Home again, she desperately tries to hide the often disgusting process from her family, but her daughter Jennifer and her - from horror magazines well educated - friend recognize what's going on, and help to kill the non-human.",1989-11-11,90,tagline,4
2212,Nightwatch,https://image.tmdb.org/t/p/w500//2ueCI9QX9AGa4SzJgrvK1fONCa5.jpg,https://image.tmdb.org/t/p/original//wHG6nBPOvJzK4UeqW9thKdoDRYf.jpg,"A law student, who takes a job as a night watchman at a morgue, begins to discover clues that implicate him as the suspect of a series of murders.",1997-01-31,102,tagline,6
2291,Jacob's Ladder,https://image.tmdb.org/t/p/w500//4GY4FsM0ZOtbSTeMpY0g4WkEuBW.jpg,https://image.tmdb.org/t/p/original//6Kxz3A1jMbSDEKb09B1Xd6ZUZJJ.jpg,"After returning home from the Vietnam War, veteran Jacob Singer struggles to maintain his sanity. Plagued by hallucinations and flashbacks, Singer rapidly falls apart as the world and people around him morph and twist into disturbing images. His girlfriend, Jezzie, and ex-wife, Sarah, try to help, but to little avail. Even Singer's chiropractor friend, Louis, fails to reach him as he descends into madness.",1990-11-02,113,The most frightening thing about Jacob Singer's nightmare is that he isn't dreaming.,7
2386,Le collectionneur de cerveaux,https://image.tmdb.org/t/p/w500//ul1JzdS4rYnjXwyW1SRwtBnG5Dd.jpg,https://image.tmdb.org/t/p/original//4gYlbYK58rqOEQf3VRhQPUZeZGW.jpg,A young pianist is shocked when she witnesses a strange chess tournament with a robot. Could there be a gruesome secret behind this exhibition?,1976-10-23,93,tagline,6
2637,The Mothman Prophecies,https://image.tmdb.org/t/p/w500//z2PiOTyjbCOnMHY2QJdq3I4jU44.jpg,https://image.tmdb.org/t/p/original//6FSoZZTwYYrhs5lWdLhj9FCPtT9.jpg,Reporter John Klein is plunged into a world of impossible terror and unthinkable chaos when fate draws him to a sleepy West Virginia town whose residents are being visited by a great winged shape that sows hideous nightmares and fevered visions.,2002-01-25,119,What do you see?,6
2654,In the Mouth of Madness,https://image.tmdb.org/t/p/w500//tvGoySYpR0ZBXeqsS7nT9peFsrn.jpg,https://image.tmdb.org/t/p/original//iuRHfeN28bRuXk2Q87RlnruYg8K.jpg,An insurance investigator begins discovering that the impact a horror writer's books have on his fans is more than inspirational.,1995-02-03,95,Lived Any Good Books Lately?,7
2655,What Lies Beneath,https://image.tmdb.org/t/p/w500//2L3Cn0CizbSy2E9KJt1SiOSyb6p.jpg,https://image.tmdb.org/t/p/original//qvMbGkEv9mVTPZpVPkrhpXrpv9E.jpg,"When Claire Spencer starts hearing ghostly voices and seeing spooky images, she wonders if an otherworldly spirit is trying to contact her. All the while, her husband tries to reassure her by telling her it's all in her head. But as Claire investigates, she discovers that the man she loves might know more than he's letting on.",2000-07-21,130,He was the perfect husband until his one mistake followed them home.,6
2662,House of 1000 Corpses,https://image.tmdb.org/t/p/w500//zEAVm1zpjkk4XFL2i5EZehkEgkH.jpg,https://image.tmdb.org/t/p/original//j5gi60OUwOeHHfDssa855c5LSJ6.jpg,Two teenage couples traveling across the backwoods of Texas searching for urban legends of serial killers end up as prisoners of a bizarre and sadistic backwater family of serial killers.,2003-04-11,89,You'll never get out alive.,6
2667,The Blair Witch Project,https://image.tmdb.org/t/p/w500//9050VGrYjYrEjpOvDZVAngLbg1f.jpg,https://image.tmdb.org/t/p/original//4enK0hfkyqljQvFqACcx74c007e.jpg,"In October of 1994 three student filmmakers disappeared in the woods near Burkittsville, Maryland, while shooting a documentary. A year later their footage was found.",1999-07-14,81,Everything you've heard is true.,6